{
  "schema_version": 1,
  "company": "REPLACE_ME",
  "role": "REPLACE_ME",
  "example": false,
  "source": "job.md",
  "source_sha256": "0000000000000000000000000000000000000000000000000000000000000000",
  "captured": "2026-10-27",
  "requirements": [
    {
      "id": "required-qualification",
      "text": "REPLACE_ME",
      "importance": "required",
      "terms": [
        "REPLACE_ME"
      ],
      "locator": "L1-L1"
    }
  ]
}
